fund_name,vintage_year,capital_committed,capital_contributed,capital_distributed,nav,tvpi,net_irr,source,reporting_period,scraped_date
"ABRY Partners VII, L.P.",2011,75000000.0,70905043.0,125939118.0,,1.78,0.148,Florida SBA,2020-Q2,2025-02-19
"ABRY Partners VIII, L.P.",2014,75000000.0,76032038.0,95940316.0,,1.26,0.108,Florida SBA,2020-Q2,2025-02-19
"Accel-KKR Structured Capital Partners II, LP",2014,25000000.0,23533608.0,15894398.0,16754946.0,1.39,0.178,Florida SBA,2020-Q2,2025-02-19
Accel-KKR Capital Partners V,2015,50000000.0,30583587.0,14686182.0,26960834.0,1.36,0.2189999999999999,Florida SBA,2020-Q2,2025-02-19
"Accel-KKR Capital Partners VI, LP",2019,45000000.0,0.0,0.0,,,,Florida SBA,2020-Q2,2025-02-19
"Advent International GPE VI-D, L.P.",2008,58000000.0,58000000.0,113132516.0,8132864.0,2.09,0.1669999999999999,Florida SBA,2020-Q2,2025-02-19
"Advent International GPE VII-D, L.P.",2012,102335815.0,93277480.0,86268566.0,69098289.0,1.67,0.127,Florida SBA,2020-Q2,2025-02-19
Advent International Global Private Equity VIII-D,2016,150000000.0,140550002.0,0.0,189063732.0,1.35,0.141,Florida SBA,2020-Q2,2025-02-19
Advent International GPE IX Limited Partnership,2019,150000000.0,36750000.0,0.0,42773695.0,1.16,,Florida SBA,2020-Q2,2025-02-19
"American Industrial Partners Capital Fund VI, L.P.",2015,50000000.0,55748004.0,12952120.0,53680633.0,1.2,0.083,Florida SBA,2020-Q2,2025-02-19
"American Industrial Partners Capital Fund VII, L.P.",2019,75000000.0,3974412.0,835.0,3344735.0,0.84,,Florida SBA,2020-Q2,2025-02-19
"Apax VIII-B, L.P.",2012,157584000.0,168455153.0,253494572.0,,1.5,0.1369999999999999,Florida SBA,2020-Q2,2025-02-19
"Apollo Investment Fund IV, L.P.",1997,250000000.0,255492548.0,387190065.0,,1.52,0.068,Florida SBA,2020-Q2,2025-02-19
"Apollo Investment Fund V, L.P.",2000,150000000.0,139648802.0,371551048.0,,2.66,0.3879999999999999,Florida SBA,2020-Q2,2025-02-19
Apollo Investment Fund VI L.P.,2005,200000000.0,180181073.0,306469710.0,,1.7,0.095,Florida SBA,2020-Q2,2025-02-19
"Apollo Investment Fund VII, L.P.",2007,200000000.0,168245182.0,327068247.0,,1.94,0.23,Florida SBA,2020-Q2,2025-02-19
"Apollo Investment Fund VIII, L.P.",2012,200000000.0,201263700.0,106485196.0,148278101.0,1.27,0.083,Florida SBA,2020-Q2,2025-02-19
"Apollo Investment Fund IX, L.P.",2016,200000000.0,53940714.0,5053192.0,45997719.0,0.95,-0.084,Florida SBA,2020-Q2,2025-02-19
"Ardian LBO Fund VI, L.P",2016,98905446.0,98323761.0,17502364.0,95134438.0,1.15,0.071,Florida SBA,2020-Q2,2025-02-19
"Ardian Secondary Fund VI, L.P.",2013,150000000.0,124198086.0,137227555.0,31220470.0,1.36,0.108,Florida SBA,2020-Q2,2025-02-19
"Ares Corporate Opportunities Fund III, L.P.",2007,100000000.0,92978467.0,229650044.0,13208051.0,2.61,0.217,Florida SBA,2020-Q2,2025-02-19
"Ares Corporate Opportunities Fund IV, L.P.",2012,200000000.0,202385315.0,184943936.0,156890872.0,1.69,0.14,Florida SBA,2020-Q2,2025-02-19
Ares Corporate Opportunities Fund V,2015,200000000.0,182032110.0,26749628.0,135550560.0,0.89,-0.076,Florida SBA,2020-Q2,2025-02-19
"ASF VII, L.P.",2015,150000000.0,93602064.0,24912729.0,83571741.0,1.16,0.09,Florida SBA,2020-Q2,2025-02-19
ASF VIII B L.P.,2018,200000000.0,47612354.0,11556785.0,39132509.0,1.06,0.1969999999999999,Florida SBA,2020-Q2,2025-02-19
"Asia Alternatives FL Investor, LP",2014,200000000.0,184431504.0,48449634.0,203069830.0,1.36,0.1159999999999999,Florida SBA,2020-Q2,2025-02-19
"Asia Alternatives FL Investor II, LP",2017,270000000.0,115935597.0,2260063.0,123868713.0,1.09,0.0819999999999999,Florida SBA,2020-Q2,2025-02-19
"Asia Alternatives FL Investor III, LP",2017,100000000.0,23260048.0,0.0,23527521.0,1.01,,Florida SBA,2020-Q2,2025-02-19
Atlas Capital Resources II,2013,20000000.0,21784226.0,12877047.0,18572893.0,1.44,0.177,Florida SBA,2020-Q2,2025-02-19
"Atlas Capital Resources III, L.P.",2018,40000000.0,16335160.0,6143551.0,12946224.0,1.17,0.26,Florida SBA,2020-Q2,2025-02-19
"AXA LBO Fund V, L.P.",2012,76858858.0,69399091.0,79945411.0,27350933.0,1.55,0.115,Florida SBA,2020-Q2,2025-02-19
"AXA Secondary Fund V, L.P.",2010,100000000.0,82203061.0,130899364.0,698511.0,1.6,0.163,Florida SBA,2020-Q2,2025-02-19
"BC European Capital IX, L.P.",2010,101118077.0,48925064.0,53495693.0,,1.09,0.0579999999999999,Florida SBA,2020-Q2,2025-02-19
"Berkshire Fund VIII, L.P.",2011,60000000.0,58540923.0,99780218.0,,1.7,0.161,Florida SBA,2020-Q2,2025-02-19
"Berkshire Fund IX, L.P.",2015,110000000.0,47361256.0,58765743.0,,1.24,0.223,Florida SBA,2020-Q2,2025-02-19
"Blackstone Capital Partners V, L.P.",2005,150000000.0,146104648.0,234262007.0,,1.6,0.071,Florida SBA,2020-Q2,2025-02-19
"Blackstone Capital Partners VI, L.P.",2007,200000000.0,198767041.0,187323600.0,120894183.0,1.55,0.106,Florida SBA,2020-Q2,2025-02-19
"Blackstone Capital Partners VII, L.P.",2014,180000000.0,167798365.0,17232642.0,175601996.0,1.15,0.098,Florida SBA,2020-Q2,2025-02-19
Blackstone Capital Partners VIII L.P.,2018,100000000.0,0.0,0.0,,,,Florida SBA,2020-Q2,2025-02-19
"Carlyle Asia Growth Partners IV, L.P.",2008,75000000.0,75215296.0,69457345.0,11391148.0,1.07,0.017,Florida SBA,2020-Q2,2025-02-19
"Carlyle Europe Partners III, L.P.",2006,66000377.0,65044510.0,104866855.0,,1.61,0.129,Florida SBA,2020-Q2,2025-02-19
"Carlyle Partners II, L.P.",1994,200000000.0,218972346.0,503409025.0,,2.3,0.201,Florida SBA,2020-Q2,2025-02-19
"Carlyle Partners III, L.P.",1999,200000000.0,195781707.0,450780798.0,,2.3,0.228,Florida SBA,2020-Q2,2025-02-19
"Carlyle Partners IV, L.P.",2004,75000000.0,73622286.0,149624496.0,,2.03,0.131,Florida SBA,2020-Q2,2025-02-19
"Carlyle Partners V, L.P.",2007,200000000.0,175586973.0,317900250.0,,1.81,0.135,Florida SBA,2020-Q2,2025-02-19
"Carlyle Partners VI, L.P.",2012,133400000.0,210208571.0,169846323.0,146201284.0,1.5,0.142,Florida SBA,2020-Q2,2025-02-19
Carlyle Partners VII,2017,100000000.0,39773112.0,211700.0,36202766.0,0.92,-0.11,Florida SBA,2020-Q2,2025-02-19
Carnelian Energy Capital II,2017,40000000.0,21580249.0,3979066.0,15716899.0,0.91,-0.067,Florida SBA,2020-Q2,2025-02-19
"Carnelian Energy Capital III, L.P.",2019,75000000.0,1943595.0,0.0,528996.0,0.27,,Florida SBA,2020-Q2,2025-02-19
"Centre Capital Investors II, L.P.",1995,200000000.0,257132909.0,208034779.0,,0.81,-0.0409999999999999,Florida SBA,2020-Q2,2025-02-19
"Charlesbank Equity Fund VII, L.P.",2009,75000000.0,73513055.0,136419954.0,26326855.0,2.21,0.2339999999999999,Florida SBA,2020-Q2,2025-02-19
"Charlesbank Equity Fund VIII, L.P.",2014,85000000.0,94400611.0,66235108.0,64204600.0,1.38,0.139,Florida SBA,2020-Q2,2025-02-19
"Charlesbank Equity Fund IX, L.P.",2017,105000000.0,44832134.0,1685923.0,47326835.0,1.09,0.086,Florida SBA,2020-Q2,2025-02-19
Charlesbank Fund IX Overage Allocation Program,2018,20000000.0,12651194.0,0.0,16332076.0,1.29,0.181,Florida SBA,2020-Q2,2025-02-19
"Charterhouse Capital Partners IX, L.P.",2008,90366890.0,71396612.0,96335016.0,,1.35,0.1369999999999999,Florida SBA,2020-Q2,2025-02-19
"Chartwell Capital Investors II, L.P.",1998,50000000.0,52675460.0,70708181.0,,1.34,0.047,Florida SBA,2020-Q2,2025-02-19
"Corporate Partners, L.P.",1988,149192410.0,118102670.0,251812055.0,,2.13,0.124,Florida SBA,2020-Q2,2025-02-19
"Cortec Group Fund V, L.P.",2010,50000000.0,51154398.0,192544940.0,19595625.0,4.15,0.309,Florida SBA,2020-Q2,2025-02-19
"Cortec Group Fund VI, L.P.",2015,75000000.0,80299517.0,18172496.0,59368901.0,0.97,-0.019,Florida SBA,2020-Q2,2025-02-19
"Cressey & Company Fund IV, L.P.",2007,50000000.0,47090057.0,102998880.0,1150368.0,2.21,0.221,Florida SBA,2020-Q2,2025-02-19
Cressey & Company Fund V LP,2014,75000000.0,70125000.0,21478462.0,88183181.0,1.56,0.166,Florida SBA,2020-Q2,2025-02-19
Cressey & Company Fund VI LP,2018,100000000.0,25000000.0,0.0,28310883.0,1.13,0.113,Florida SBA,2020-Q2,2025-02-19
Cressey & Company Overage Fund VI LP,2018,10000000.0,2890000.0,0.0,4154822.0,1.44,0.267,Florida SBA,2020-Q2,2025-02-19
"CVC European Equity Partners V, L.P.",2007,102826253.0,93349544.0,181306230.0,11628055.0,2.07,0.1669999999999999,Florida SBA,2020-Q2,2025-02-19
"CVC Capital Partners VI, L.P.",2013,102645517.0,91432740.0,47500296.0,84442412.0,1.44,0.138,Florida SBA,2020-Q2,2025-02-19
CVC Capital Partners VII,2016,102163598.0,55902956.0,1212982.0,59908602.0,1.09,0.103,Florida SBA,2020-Q2,2025-02-19
CVC Capital Partners VIII (A) L.P.,2019,222518914.0,0.0,0.0,,,,Florida SBA,2020-Q2,2025-02-19
Cypress Equity Group Trust,1996,15000000.0,9231932.0,19830011.0,,2.15,0.161,Florida SBA,2020-Q2,2025-02-19
"Datadog, Inc.",2019,70564685.0,70564685.0,66776920.0,47942665.0,1.63,,Florida SBA,2020-Q2,2025-02-19
DCPF VI Oil and Gas Coinvestment Fund LP,2013,50000000.0,43044132.0,63854731.0,4049797.0,1.58,0.157,Florida SBA,2020-Q2,2025-02-19
"Denham Commodity Partners Fund VI, L.P.",2011,100000000.0,114927131.0,67172391.0,48841863.0,1.01,0.003,Florida SBA,2020-Q2,2025-02-19
Denham Oil & Gas Fund LP,2016,100000000.0,78653498.0,43638241.0,24309224.0,0.86,-0.088,Florida SBA,2020-Q2,2025-02-19
Denham Oil & Gas Fund II LP,2019,75000000.0,0.0,0.0,,,,Florida SBA,2020-Q2,2025-02-19
"EnCap Energy Capital Fund VIII, L.P.",2010,75000000.0,74306338.0,40822748.0,11708413.0,0.71,-0.104,Florida SBA,2020-Q2,2025-02-19
"EnCap Energy Capital Fund IX, L.P.",2012,75000000.0,79493329.0,59467760.0,20508171.0,1.01,0.002,Florida SBA,2020-Q2,2025-02-19
"EnCap Energy Capital Fund X, L.P.",2015,100000000.0,91768359.0,19741126.0,63246943.0,0.9,-0.0409999999999999,Florida SBA,2020-Q2,2025-02-19
"EnCap Energy Capital Fund XI, L.P.",2016,100000000.0,30149055.0,0.0,17923776.0,0.59,-0.3429999999999999,Florida SBA,2020-Q2,2025-02-19
EnCap Flatrock Midstream Fund III,2014,50000000.0,59978715.0,26656708.0,40131628.0,1.11,0.07,Florida SBA,2020-Q2,2025-02-19
EnCap Flatrock Midstream Fund IV,2017,65000000.0,28837480.0,6793749.0,24377713.0,1.08,0.062,Florida SBA,2020-Q2,2025-02-19
"Energy Capital Partners II, L.P.",2008,100000000.0,71972174.0,99608080.0,3611745.0,1.43,0.083,Florida SBA,2020-Q2,2025-02-19
"Energy Capital Partners III, L.P.",2013,150000000.0,170719501.0,67020995.0,140058775.0,1.21,0.076,Florida SBA,2020-Q2,2025-02-19
"EnerVest Energy Institutional Fund XII, Ltd",2009,60000000.0,60004730.0,38071041.0,272225.0,0.64,-0.193,Florida SBA,2020-Q2,2025-02-19
"EnerVest Energy Institutional Fund XIII, Ltd.",2012,100000000.0,105981851.0,9552979.0,1.0,0.09,-0.959,Florida SBA,2020-Q2,2025-02-19
EnerVest Energy Institutional Fund XIV,2015,100000000.0,104238328.0,50546505.0,37962507.0,0.85,-0.06,Florida SBA,2020-Q2,2025-02-19
Equistone European Fund V,2015,74366455.0,70701017.0,8829329.0,69533330.0,1.11,0.031,Florida SBA,2020-Q2,2025-02-19
Equistone Partners Europe Fund VI,2017,88195865.0,33075319.0,0.0,31049587.0,0.94,-0.075,Florida SBA,2020-Q2,2025-02-19
"European Private Equity Opportunities I, L.P.",2016,49181385.0,30630329.0,3386454.0,18207605.0,0.7,-0.247,Florida SBA,2020-Q2,2025-02-19
European Private Equity Opportunities II LP,2019,77094209.0,0.0,0.0,,,,Florida SBA,2020-Q2,2025-02-19
"Falfurrias Capital Partners IV, LP",2019,60000000.0,10800000.0,0.0,21158725.0,1.96,,Florida SBA,2020-Q2,2025-02-19
"Fairview Special Opportunities Fund, L.P.",2011,220000000.0,210143576.0,163006929.0,366692201.0,2.52,0.206,Florida SBA,2020-Q2,2025-02-19
Fairview Special Opportunities Fund II,2015,87000000.0,79870629.0,4966398.0,124264189.0,1.62,0.174,Florida SBA,2020-Q2,2025-02-19
"Fairview Ventures Fund II, L.P.",2002,50000000.0,50000000.0,67065957.0,,1.34,0.039,Florida SBA,2020-Q2,2025-02-19
"Fairview Ventures III, L.P.",2006,75000000.0,73800000.0,134937967.0,,1.83,0.118,Florida SBA,2020-Q2,2025-02-19
"First Reserve Fund XI, L.P.",2006,100000000.0,100000000.0,63007054.0,105242.0,0.63,-0.102,Florida SBA,2020-Q2,2025-02-19
"First Reserve Fund XII, L.P.",2008,200000000.0,210333084.0,99549567.0,18248871.0,0.56,-0.128,Florida SBA,2020-Q2,2025-02-19
"Francisco Partners IV, LP",2014,75000000.0,73087500.0,63270014.0,105663135.0,2.31,0.293,Florida SBA,2020-Q2,2025-02-19
"Francisco Partners V, L.P.",2017,75000000.0,39000000.0,0.0,44115578.0,1.13,0.081,Florida SBA,2020-Q2,2025-02-19
"Francisco Partners VI, L.P.",2019,100000000.0,0.0,0.0,,,,Florida SBA,2020-Q2,2025-02-19
"FS Equity Partners V, L.P.",2002,50000000.0,40136967.0,84176286.0,,2.1,0.161,Florida SBA,2020-Q2,2025-02-19
"FS Equity Partners VI, L.P.",2009,75000000.0,76714592.0,188494811.0,37337085.0,2.94,0.2289999999999999,Florida SBA,2020-Q2,2025-02-19
"FS Equity Partners VII, L.P.",2014,100000000.0,107450773.0,24398494.0,103156820.0,1.19,0.061,Florida SBA,2020-Q2,2025-02-19
"FS Equity Partners VIII, L.P.",2018,100000000.0,30497749.0,1514227.0,25011797.0,0.87,-0.236,Florida SBA,2020-Q2,2025-02-19
"Gores Capital Partners, L.P.",2003,50000000.0,47063636.0,60965147.0,,1.3,0.084,Florida SBA,2020-Q2,2025-02-19
"Gores Capital Partners II, L.P.",2007,50000000.0,45307913.0,51590459.0,,1.14,0.038,Florida SBA,2020-Q2,2025-02-19
"Gores Capital Partners III, L.P.",2009,125000000.0,105124539.0,104839695.0,,1.0,-0.001,Florida SBA,2020-Q2,2025-02-19
"Green Equity Investors III, L.P.",1998,60000000.0,54613145.0,125883576.0,,2.31,0.2189999999999999,Florida SBA,2020-Q2,2025-02-19
"Green Equity Investors IV, L.P.",2002,100000000.0,122786720.0,218999019.0,,1.78,0.107,Florida SBA,2020-Q2,2025-02-19
"Green Equity Investors V, L.P.",2006,100000000.0,101347021.0,196627503.0,,1.94,0.174,Florida SBA,2020-Q2,2025-02-19
"Green Equity Investors VI, L.P.",2011,200000000.0,193567043.0,242730354.0,,1.25,0.123,Florida SBA,2020-Q2,2025-02-19
"Grove Street Partners Buyout, L.P.",2006,150000000.0,150398135.0,220243686.0,22059963.0,1.61,0.102,Florida SBA,2020-Q2,2025-02-19
"Grove Street Partners Buyout II, L.P.",2010,230000000.0,224654077.0,144256362.0,173851356.0,1.42,0.11,Florida SBA,2020-Q2,2025-02-19
"Grove Street Partners Ventures, L.P.",2004,200000000.0,213828809.0,333558289.0,,1.56,0.072,Florida SBA,2020-Q2,2025-02-19
"Grove Street Partners Ventures II, L.P.",2008,200000000.0,218675931.0,374237838.0,274544756.0,2.97,0.21,Florida SBA,2020-Q2,2025-02-19
"Grove Street Partners Ventures III, L.P.",2012,150000000.0,157571990.0,47751745.0,255601382.0,1.93,0.171,Florida SBA,2020-Q2,2025-02-19
"Hahn & Company III L.P.,",2018,50000000.0,11743681.0,981691.0,9861539.0,0.92,,Florida SBA,2020-Q2,2025-02-19
"Hellman & Friedman Capital Partners V, L.P.",2004,75000000.0,67744774.0,185424201.0,,2.74,0.294,Florida SBA,2020-Q2,2025-02-19
"Hellman & Friedman Capital Partners VI, L.P.",2006,100000000.0,97041660.0,173450549.0,,1.79,0.126,Florida SBA,2020-Q2,2025-02-19
"Hellman & Friedman Capital Partners VII, L.P.",2009,200000000.0,191286482.0,286616520.0,269877943.0,2.91,0.241,Florida SBA,2020-Q2,2025-02-19
"Hellman & Friedman Capital Partners VIII, L.P.",2014,200000000.0,202160361.0,19758112.0,241272813.0,1.29,0.133,Florida SBA,2020-Q2,2025-02-19
"Hellman & Friedman Capital Partners IX, L.P.",2018,250000000.0,55301789.0,0.0,52750095.0,0.95,,Florida SBA,2020-Q2,2025-02-19
"Hicks, Muse, Tate & Furst Equity Fund III, L.P.",1996,200000000.0,210258927.0,186304423.0,,0.89,-0.018,Florida SBA,2020-Q2,2025-02-19
"Hicks, Muse, Tate & Furst Equity Fund IV, L.P.",1998,400000000.0,423434828.0,266275496.0,,0.63,-0.088,Florida SBA,2020-Q2,2025-02-19
"Hicks, Muse, Tate & Furst Equity Fund V, L.P.",2000,25000000.0,27231920.0,48289446.0,,1.77,0.21,Florida SBA,2020-Q2,2025-02-19
"Inflexion Buyout Fund IV, L.P.",2014,52587527.0,50287349.0,13143178.0,41746792.0,1.09,0.039,Florida SBA,2020-Q2,2025-02-19
Inflexion Enterprise Fund IV,2016,19982149.0,22689375.0,5774464.0,18450619.0,1.07,0.045,Florida SBA,2020-Q2,2025-02-19
"Inflexion Partnership Capital Fund I, L.P.",2014,26372724.0,25729800.0,12425219.0,18539747.0,1.2,0.095,Florida SBA,2020-Q2,2025-02-19
"Insight Venture Partners Growth-Buyout Coinvestment Fund, L.P.",2014,50000000.0,48000000.0,21496809.0,97900810.0,2.49,0.307,Florida SBA,2020-Q2,2025-02-19
"Insight Venture Partners VIII, L.P.",2013,75000000.0,77847811.0,108310816.0,91434703.0,2.57,0.205,Florida SBA,2020-Q2,2025-02-19
"Insight Venture Partners IX, L.P.",2014,75000000.0,76759181.0,18356096.0,159809982.0,2.32,0.265,Florida SBA,2020-Q2,2025-02-19
"Investindustrial VI, L.P.",2015,55802326.0,52562707.0,275233.0,51522793.0,0.99,-0.008,Florida SBA,2020-Q2,2025-02-19
Investindustrial VII L.P.,2018,76982294.0,5033723.0,0.0,4029314.0,0.8,,Florida SBA,2020-Q2,2025-02-19
"J.H. Whitney VII, L.P.",2010,75000000.0,76343685.0,59281951.0,75210635.0,1.76,0.128,Florida SBA,2020-Q2,2025-02-19
"Kelso Investment Associates VII, L.P.",2003,50000000.0,47514909.0,81982841.0,,1.73,0.122,Florida SBA,2020-Q2,2025-02-19
"Kelso Investment Associates VIII, L.P.",2007,100000000.0,85871953.0,135469605.0,,1.58,0.138,Florida SBA,2020-Q2,2025-02-19
"KKR Asian Fund II, L.P.",2011,100000000.0,111832105.0,63342438.0,89658952.0,1.37,0.0969999999999999,Florida SBA,2020-Q2,2025-02-19
"KKR Asian Fund III, L.P.",2016,150000000.0,90330654.0,19263238.0,95478462.0,1.27,0.2339999999999999,Florida SBA,2020-Q2,2025-02-19
"KKR European Fund III, L.P.",2007,58757859.0,50706630.0,53362696.0,,1.05,0.018,Florida SBA,2020-Q2,2025-02-19
"Kohlberg Investors V, L.P.",2004,45000000.0,42466621.0,45208998.0,,1.06,0.012,Florida SBA,2020-Q2,2025-02-19
"Kohlberg Investors VI, L.P.",2007,50000000.0,43063311.0,72089155.0,,1.67,0.158,Florida SBA,2020-Q2,2025-02-19
"KPS Special Situations Supplemental Fund III, L.P.",2009,50000000.0,31895331.0,84713785.0,431164.0,2.67,0.226,Florida SBA,2020-Q2,2025-02-19
"KPS Special Situations Fund IV, L.P.",2013,150000000.0,130234529.0,33517492.0,120331713.0,1.18,0.12,Florida SBA,2020-Q2,2025-02-19
"KPS Special Situations Fund V (A), LP",2019,200000000.0,0.0,0.0,,,,Florida SBA,2020-Q2,2025-02-19
"KPS Special Situations Mid-Cap Fund, LP",2019,50000000.0,8865944.0,0.0,8418193.0,0.95,,Florida SBA,2020-Q2,2025-02-19
LCP FSBA Co-Invest Account,2016,200000000.0,98357979.0,33895472.0,105935915.0,1.42,0.241,Florida SBA,2020-Q2,2025-02-19
"Lexington Capital Partners IV, L.P.",2000,200000000.0,196224328.0,348392190.0,,1.78,0.2019999999999999,Florida SBA,2020-Q2,2025-02-19
"Lexington Capital Partners V, L.P.",2001,100000000.0,99513278.0,166745049.0,519641.0,1.68,0.1889999999999999,Florida SBA,2020-Q2,2025-02-19
"Lexington Capital Partners VI, L.P.",2005,100000000.0,106132653.0,137945109.0,6347784.0,1.36,0.064,Florida SBA,2020-Q2,2025-02-19
"Lexington Capital Partners VII, L.P.",2009,200000000.0,174592348.0,234021369.0,39860590.0,1.57,0.135,Florida SBA,2020-Q2,2025-02-19
"Lexington Capital Partners VIII, L.P.",2013,250000000.0,222252099.0,128836324.0,158794814.0,1.29,0.138,Florida SBA,2020-Q2,2025-02-19
"Lexington Capital Partners IX, L.P.",2018,250000000.0,17704999.0,4729219.0,24850186.0,1.67,,Florida SBA,2020-Q2,2025-02-19
Lexington CIP V-F-O,2020,200000000.0,0.0,0.0,,,,Florida SBA,2020-Q2,2025-02-19
"Lexington Co-Investment Partners (Pools I & II), L.P.",1998,500000000.0,499974505.0,675610817.0,,1.35,0.063,Florida SBA,2020-Q2,2025-02-19
"Lexington Co-Investment Partners II (Pools III & IV), L.P.",1998,500000000.0,495794418.0,1073220891.0,6986256.0,2.18,0.2339999999999999,Florida SBA,2020-Q2,2025-02-19
"Lexington Co-Investment Partners 2005 (Pools I & II), L.P.",2005,500000000.0,497964643.0,643552297.0,63984492.0,1.42,0.052,Florida SBA,2020-Q2,2025-02-19
"Lexington Co-Investment Partners 2005 (Pool III), L.P.",2012,500000000.0,524183985.0,616359651.0,340959806.0,1.83,0.168,Florida SBA,2020-Q2,2025-02-19
Lexington Co-Investment Partners 2005 Pool IV,2015,500000000.0,474240000.0,48611489.0,545412444.0,1.25,0.156,Florida SBA,2020-Q2,2025-02-19
"Lexington Co-Investment Partners V, L.P.",2019,150000000.0,0.0,0.0,,,,Florida SBA,2020-Q2,2025-02-19
"Lexington Middle Market Investors III, L.P.",2012,100000000.0,80776463.0,65231581.0,50026904.0,1.43,0.143,Florida SBA,2020-Q2,2025-02-19
Liberty Partners Pool I,1993,205686600.0,198347330.0,465437875.0,,2.35,0.207,Florida SBA,2020-Q2,2025-02-19
Liberty Partners Pool II,1994,359789821.0,376606498.0,605073932.0,,1.61,0.107,Florida SBA,2020-Q2,2025-02-19
Liberty Partners Pool III,1996,506208481.0,529232632.0,538362219.0,,1.02,0.004,Florida SBA,2020-Q2,2025-02-19
Liberty Partners Pool IV,1998,195075745.0,198104313.0,132103527.0,,0.67,-0.192,Florida SBA,2020-Q2,2025-02-19
Liberty Partners Pool V,1999,329664359.0,347297915.0,396920863.0,,1.14,0.027,Florida SBA,2020-Q2,2025-02-19
Liberty Partners Pool VI,2002,595484687.0,1315567216.0,1128135042.0,13000.0,0.86,-0.066,Florida SBA,2020-Q2,2025-02-19
Liberty Partners Pool VII,2005,290808542.0,251874140.0,210667930.0,2559626.0,0.85,-0.073,Florida SBA,2020-Q2,2025-02-19
"Liberty Partners Group II, L.P.",2008,9766830.0,741589.0,0.0,,0.0,-1.0,Florida SBA,2020-Q2,2025-02-19
Lightbay Investment Partners LP,2016,50000000.0,15867889.0,1109106.0,13799950.0,0.94,-0.071,Florida SBA,2020-Q2,2025-02-19
"Lindsay, Goldberg & Bessemer II, L.P.",2006,100000000.0,92552700.0,137178856.0,,1.48,0.08,Florida SBA,2020-Q2,2025-02-19
"Lindsay, Goldberg & Bessemer III, L.P.",2008,100000000.0,92507383.0,109182421.0,,1.18,0.068,Florida SBA,2020-Q2,2025-02-19
Livingbridge Enterprise 3 LP,2018,32305168.0,1129276.0,0.0,16792.0,0.01,,Florida SBA,2020-Q2,2025-02-19
Livingbridge 7 LP,2020,79484938.0,0.0,0.0,,,,Florida SBA,2020-Q2,2025-02-19
"MBK Partners Fund V, L.P.",2019,100000000.0,0.0,0.0,,,,Florida SBA,2020-Q2,2025-02-19
"Montagu Private Equity IV, L.P.",2010,56819796.0,47196996.0,65597905.0,8396155.0,1.57,0.133,Florida SBA,2020-Q2,2025-02-19
Montagu V,2014,111109877.0,90359707.0,26055408.0,79780022.0,1.17,0.093,Florida SBA,2020-Q2,2025-02-19
Montagu VI L.P.,2019,85323261.0,0.0,0.0,,,,Florida SBA,2020-Q2,2025-02-19
"New Mountain Partners II, L.P.",2004,50000000.0,40792023.0,82743413.0,839075.0,2.05,0.136,Florida SBA,2020-Q2,2025-02-19
"New Mountain Partners III, L.P.",2007,100000000.0,93307647.0,132238789.0,76249111.0,2.23,0.134,Florida SBA,2020-Q2,2025-02-19
"New Mountain Partners IV, L.P.",2012,100000000.0,89703570.0,142727228.0,,1.59,0.221,Florida SBA,2020-Q2,2025-02-19
OpCapita Consumer Opportunities Fund II,2016,38251366.0,28685331.0,586988.0,22930788.0,0.82,-0.091,Florida SBA,2020-Q2,2025-02-19
"OpCapita Consumer Opportunities Fund III, L.P.",2019,38682154.0,509961.0,0.0,1.0,0.0,,Florida SBA,2020-Q2,2025-02-19
"OpenView Venture Partners IV, L.P.",2014,25000000.0,25000000.0,683616.0,37079336.0,1.51,0.13,Florida SBA,2020-Q2,2025-02-19
"OpenView Venture Partners V, L.P.",2017,25000000.0,21917500.0,4265991.0,28151828.0,1.48,0.31,Florida SBA,2020-Q2,2025-02-19
"OpenView Venture Partners VI, L.P.",2019,30000000.0,630000.0,0.0,393983.0,0.63,,Florida SBA,2020-Q2,2025-02-19
"PAI Europe V, L.P.",2007,42563071.0,35666465.0,46401458.0,,1.3,0.07,Florida SBA,2020-Q2,2025-02-19
"Pantheon Global Secondary Fund IV, L.P.",2008,100000000.0,66400000.0,89403617.0,14319193.0,1.56,0.13,Florida SBA,2020-Q2,2025-02-19
"Pantheon Venture Partners II, L.P.",2004,100000000.0,98247500.0,149766811.0,,1.52,0.068,Florida SBA,2020-Q2,2025-02-19
"Paul Capital Top Tier Investments II, L.P.",2001,120000000.0,115159193.0,154866240.0,,1.34,0.043,Florida SBA,2020-Q2,2025-02-19
"Paul Capital Top Tier Investments III, L.P.",2004,75000000.0,73396164.0,91353829.0,11126267.0,1.4,0.053,Florida SBA,2020-Q2,2025-02-19
"Paul Capital Top Tier Investments IV, L.P.",2007,100000000.0,101694458.0,203199504.0,,2.0,0.139,Florida SBA,2020-Q2,2025-02-19
"Paul Capital Top Tier Special Opportunities Fund, L.P.",2009,12450000.0,11932501.0,7120926.0,2079364.0,0.77,-0.035,Florida SBA,2020-Q2,2025-02-19
Peak Rock Capital Credit Fund II,2016,20000000.0,5761683.0,3563316.0,2086134.0,0.98,-0.035,Florida SBA,2020-Q2,2025-02-19
"Peak Rock Capital Fund II, L.P.",2016,80000000.0,32771671.0,18165193.0,30709443.0,1.49,0.3979999999999999,Florida SBA,2020-Q2,2025-02-19
"Permira European Fund IV, L.P.",2006,64037705.0,66661814.0,104162715.0,,1.56,0.083,Florida SBA,2020-Q2,2025-02-19
"Permira V, LP",2012,136860690.0,90291430.0,111021053.0,109542032.0,2.44,0.23,Florida SBA,2020-Q2,2025-02-19
"Platinum Equity Capital Partners, L.P.",2003,50000000.0,34606203.0,100796151.0,,2.91,0.602,Florida SBA,2020-Q2,2025-02-19
"Platinum Equity Capital Partners II, L.P.",2007,75000000.0,68185880.0,106124384.0,3024902.0,1.6,0.121,Florida SBA,2020-Q2,2025-02-19
"Post Oak Energy Partners II, LP",2013,25000000.0,28880588.0,14686194.0,19993459.0,1.2,0.079,Florida SBA,2020-Q2,2025-02-19
"Post Oak Energy Partners III, LP",2016,60000000.0,52721478.0,33105343.0,26608466.0,1.13,0.071,Florida SBA,2020-Q2,2025-02-19
"Post Oak Energy Partners IV, LP",2017,60000000.0,22293959.0,33606.0,14848336.0,0.67,-0.312,Florida SBA,2020-Q2,2025-02-19
"Pomona Capital VI (Combined), L.P.",2004,50000000.0,44551931.0,56178263.0,2008654.0,1.31,0.046,Florida SBA,2020-Q2,2025-02-19
"Pomona Capital VII (Combined), L.P.",2007,50000000.0,42172835.0,55148552.0,,1.31,0.079,Florida SBA,2020-Q2,2025-02-19
"Providence Equity Partners VI, L.P.",2006,50000000.0,47684103.0,69769291.0,,1.46,0.073,Florida SBA,2020-Q2,2025-02-19
"Providence Equity Partners VII, L.P.",2011,200000000.0,216320673.0,348912401.0,,1.61,0.212,Florida SBA,2020-Q2,2025-02-19
"RCP Advisors Fund IV, L.P.",2006,50000000.0,55245286.0,99595557.0,4122265.0,1.88,0.131,Florida SBA,2020-Q2,2025-02-19
"RCP Advisors Fund V, L.P.",2007,50000000.0,58188780.0,95253514.0,9684748.0,1.8,0.143,Florida SBA,2020-Q2,2025-02-19
"RCP Advisors Fund VI, L.P.",2008,50000000.0,56967460.0,92669858.0,19874265.0,1.98,0.158,Florida SBA,2020-Q2,2025-02-19
"RCP Advisors Fund VII, L.P.",2009,50000000.0,55017993.0,71755075.0,32637375.0,1.9,0.1689999999999999,Florida SBA,2020-Q2,2025-02-19
"RCP Advisors Fund VIII, L.P.",2011,50000000.0,53992719.0,41107000.0,45523805.0,1.6,0.161,Florida SBA,2020-Q2,2025-02-19
"RCP Advisors Fund IX, L.P.",2013,50000000.0,46920623.0,15700656.0,49358997.0,1.39,0.13,Florida SBA,2020-Q2,2025-02-19
RCP Advisors Fund X,2014,50000000.0,42175500.0,5675226.0,42046022.0,1.13,0.059,Florida SBA,2020-Q2,2025-02-19
"Ripplewood Partners, L.P.",1995,100000000.0,96498975.0,168333429.0,,1.74,0.136,Florida SBA,2020-Q2,2025-02-19
